keyword	tag	sentence
would	PRMD	to Him '' , the minister had said . God would not <do> that , Kate thought stubbornly . Jonathan
'll	PRMD	's shut . He 'll choke '' . `` He 'll choke anyway '' . `` Hold his head up
would	PRMD	the subtle art of diversion . To attack Pike directly would gain Woodruff little , for as a penniless newcomer
would	PRMD	holds for values as well as life styles . One would need to test this proposition carefully ; after all
'll	PRMD	. As for coming back here - well , I 'll tell you the truth , I did n't even
will	PRMD	economy ; there are no reasonable prospects that these conditions will be corrected or changed . Lands in this last
would	PRMD	and the Ford would seek him out again . He would be harassed repeatedly and would escape death by inches
would	PRMD	state legislature to waive the requirement . Otherwise , freedom would mean removal from the state in which `` as
would	PRMD	too many people investing by this method , their operations would begin to affect stock prices , and thus throw
would	PRMD	: `` Not men-folk , but the fields where I would stray , The stones where as a child I
would	PRMD	his flight was rehearsed . Every morning contingents of prisoners would be sent out to labor in nearby factories .
would	PRMD	what and for whom , only he could tell and would not . It was as though he had made
will	PRMD	key areas to examine to make sure your pricing strategy will be on target : Has the probable price situation
would	PRMD	, but we do n't have that book . There would n't be much demand for it , I 'm
wo	PRMD	we 'll just have the vet fix it so there wo n't be any more \*\* h. I wonder if
would	PRMD	be any more \*\* h. I wonder if the Carters would take one \*\* h. And it 's no good
'll	PRMD	`` I 'll get Gray Eyes '' . `` That 'll be a pleasure to see '' , the big
will	PRMD	under this Act which are primarily of a civil nature will contribute to the defense of the Nation and that
would	PRMD	surrounded by hundreds of people the words and the melody would make me a little colder and I would reach
would	PRMD	blow to hell up and burn and nothing like that would happen . Or you could hope the parachute would
did	PROD	shows turned out to be frauds and phonies , it did irreparable damage to the ego of the editor and
do	PROD	see - and wrap 'em right over you . I do it , lots o ' times - I like
do	PROD	was often a little more than I thought they could do . `` Several times I found the players pepping
done	PROD	come back twice to finish a job they could have done on one trip . Even `` America 's most
do	PROD	the child \*\* h '' . `` The hell you do '' . Barton 's voice was rougher than Dill
do	PROD	of change raises the question `` what are we to do '' ? on the most primitive level . For
do	PROD	he was never sure why ; it was something to do with her back , the thinness of it ,
doing	PROD	staircase she stopped and sat down . Other people were doing it , too , sitting all along the wide
did	PROD	Jones played that way . Byron Nelson did , Hogan did . And last week at the Masters Palmer and
do	PROD	then there is a limit to what one person can do . By this time Diane was a beguiling lass
did	PROD	Cleaned all them Rebs out 'n the hills , they did ! They wo n't never git over inter loyal
do	PROD	it is better to pay someone with a machine to do the work . #SELECTING A FARM # Before you
done	PROD	's ? Things like that would increase rather than be done away with . One had to believe in final
does	PROD	mean by that no simple economic experience -LRB- as Marx does -RRB- but a deep spiritual sense of dislocation .
do	PROD	although legally a corporation , I have been able to do many things for my employees which `` normal ''
do	PROD	the range , it starts life 1 foot longer than do any of the other -LRB- relatively large -RRB- giants
do	PROD	practical . He simply found more work for him to do , and the articles and reviews continued without an
doing	PROD	. Their work was lonely . `` What 's she doing in this bunch '' ? Benson said , and
do	PROD	to defend your country , and you were ready to do it right then , without a second thought .
do	PROD	$ 600 to $ 900 . Two men can often do the installation in a day . You can install
done	PROD	same day for Puerto Rico , that nothing would be done until his return on January 22 , except that
did	PROD	all with Richard Whiting -RRB- ; with Harry Warren he did `` The Girl Friend of the Whirling Dervish ''
did	PROD	not to envy a gifted man , and perhaps he did \*\* h. But there were great satisfactions , even
done	PROD	those paid for by profit-sharing money , such as was done in the union contract recently signed by American Motors
do	PROD	the cowbirds . She had a day of things to do ; among them , she had to prepare the
objected	PUBV	, the most important minor party at the time , objected to the Istiqlal 's predominance in the civil service
said	PUBV	the most unique dog <I> ever saw '' , she said firmly . `` His real name 's DiMaggio ,
says	PUBV	also because God will not stop him ; as Piepsam says to the crowd in his last moments : ``
say	PUBV	finding out for myself -LRB- despite , I may now say , the unspeakable awkwardness of making the discovery on
said	PUBV	silver dollar . We could see maggots moving . John said : `` I have some antiseptic salve with me
add	PUBV	plane . #TENURE AS CRITERION # I would like to add one more practical reform to those mentioned by Russell
said	PUBV	from Ching \*\* h `` Really something '' , he said , aloud \*\* h -LRB- Dirty Reactionary bastards comin
argued	PUBV	or secretarial school . Of course , it can be argued that an ability to write English correctly and with
said	PUBV	idea . `` We grind , too '' , he said . My mother was beside herself with curiosity .
proclaiming	PUBV	would follow `` free inquiry '' to the extreme of proclaiming Christianity a `` natural '' religion . Grant all
wrote	PUBV	growing obscurity and complexity of poetry and non-poetry . I wrote a few years ago that one of the cardinal
announced	PUBV	did not hear of Digby 's disappearance when it was announced , and , when he did , while he
say	PUBV	with a club . I just wanted to hear you say so '' . Jess stared at him without answering
said	PUBV	muskets and swords in their cabins . Cook Bennett Mathues said Juet had predicted bloodshed on the ship . Others
reported	PUBV	course , fundamentalist in character . As the number of reported freight car loadings increased , this was taken to
submit	PUBV	would not be profitable , the Government was prepared to submit a plan within thirty days . Counsel for du
said	PUBV	. `` As if he were choking '' , she said . `` Poor John '' ! Edythe settled down
repeated	PUBV	the babies , who seemed colicky , bone-weary fatigue , repeated crying episodes , and short tempers reflected the family
suggested	PUBV	his inhabiting a halfway house of Judaism . Still another suggested that he would join a temple `` for social
added	PUBV	with Oldenburg , the wigmaker , and also arithmetic was added to Bible reading , German , and Danish in
say	PUBV	'' . He shrugged casually . `` But if you say you managed it \*\* h '' The stranger was
said	PUBV	hitters around the league a little better '' , he said . Hansen will engage in his first workout at
said	PUBV	does n't have any appliance or cosmetics '' , he said heatedly before he caught himself . It sounded silly
said	PUBV	has to be that way . A word should be said for Gary Morgan , a Broadway youngsters who ,
said	PUBV	<oyabun> was entertaining a group of dignitaries , the secretary said , businessmen from Tokyo for the most part ,
all	QUAN	on life , death , and the wonder of it all are distressing ; the love-making , perhaps because it
each	QUAN	emotional involvement . Such identification comes for each group in each crisis by rewriting history into legend and developing appropriate
all	QUAN	past -RRB- , and nearly light as day . They all sat around and drank ice water , and the
few	QUAN	stretches of color which reach their height from the last few days of September well into October , especially in
any	QUAN	agency , or establishment of the United States or by any court by mandamus or otherwise .  -LRB- I
some	QUAN	-RRB- sent the Hetman a telegram : `` Please find some more reporters like that young man from Denver ''
Some	QUAN	at l'Universite Officielle du Congo Belge et du Ruanda-Urundi . Some 30,000 completed schedules with 20 items -LRB- collected by
all	QUAN	sense to undermine the objection itself . For what concerns all scientific disciplines is precisely that which can be captured
any	QUAN	throat . Powerful hands had killed her . `` Find any prints '' ? Chief Moore shook his big head
each	QUAN	on dictionary information made by the text-lookup operation are that each form represented by the dictionary be available for lookup
much	QUAN	following year , the new , more elaborated abstracts were much favored in the circles of the modernists as three-dimentional
all	QUAN	a solution - and the procedure worked as follows : all candidates were invited to a hotel conference room ,
much	QUAN	the 355 years since the first Guy Fawkes Night , much of the story has been forgotten , so here
all	QUAN	the land would be an `` inviolate '' sanctuary for all birds , animals and plants . Seventeen years ago
all	QUAN	: `` I ca n't forgive New England for rejecting all complicity '' . Being a teacher of American literature
all	QUAN	the receding shore with mingled regret and jubilation . Not all of Palfrey 's slaves were aboard the <Bashaw> .
all	QUAN	for this type of compilation precluded a thorough evaluation of all available data in the present edition . Future editions
many	QUAN	almost glad when she cut him off - `` Too many times '' ! - and flounced to the sink
much	QUAN	insurance package periodically . You may find certain coverage costing much more than is economically feasible , thereby alerting you
some	QUAN	fields . Mines . Ours were kinder than theirs , some said . They set bouncing betties to jump and
several	QUAN	in all realms of western culture has given rise to several generations of artists who have documented the disintegrative processes
any	QUAN	have been a prime example , though the adherents of any world or interpeople religion are cases in point .
many	QUAN	Program - and in Khrushchev 's speech - which left many points obscure . Was it the party 's intention
all	QUAN	the children are satisfied with smaller amounts of food since all of it is high in quality . The cost
some	QUAN	school work . The curriculum may be too difficult for some and too easy for others . Teaching methods ,
everything	QUPR	paper or cloth serves for a seeming moment to push everything else into a more vivid <idea> of depth than
everything	QUPR	'' . Blackman called the porter and had him remove everything but one bottle of brandy , and after that
anything	QUPR	'' , Hearst said , `` if you ever wish anything that I can do , all you will have
anything	QUPR	, and therefore its products , with an accuracy exceeding anything then available elsewhere in the world . Also important
anything	QUPR	for granted . Nurses ' training here does n't cost anything . They even pay me six dollars a month
something	QUPR	angry because he 'd thought Ma was going to do something big , something heroic even , especially for her
something	QUPR	Such modifications are all for the best but it takes something as different as a Deerstalker or a Jet to
everything	QUPR	see . They looked , even so . Looked at everything . Barbara bought some cotton aprons , and Harold
Somebody	QUPR	get back to the captain and tell him this : Somebody 's going to take a shot at the prime
somebody	QUPR	is all right instead of being able to say to somebody in a normal voice : `` I think I
everybody	QUPR	a senior departmental policy officer faces . This means practically everybody in this room . Whether it will strike home
anything	QUPR	Chris had said . I figured I could stand practically anything for a couple of weeks . But the two
Anything	QUPR	and along the north coast of Mindanao to Cagayan . Anything the enemy flew or floated was his target .
everybody	QUPR	as participant or spectator . He smoked , as did everybody , and imbibed the various alcoholic beverages of that
anything	QUPR	frontier ; at least I have only one remedy for anything of this kind in my collection , one for
everybody	QUPR	, like the models he sees , even more like everybody else . And this , I think , holds
someone	QUPR	see me too . Never Benny . Whenever he saw someone lying in the dirt , Ramey wondered what the
something	QUPR	winds and storms come from . Will the view be something you can live with ? Do n't worry too
everyone	QUPR	bases than Morton was coming to market at , and everyone who knew anything about it expected the Morton stock
Someone	QUPR	betrayed him with a creak . The shadow vanished . Someone had moved beyond the range of the light from
anything	QUPR	I had no doubt . Would n't Johnnie do practically anything in the world to insure my happiness ? Of
someone	QUPR	secluded spot anywhere on a beach to neck nowadays without someone swooping down upon them . If the character flying
everyone	QUPR	Holland , Italy , Bulgaria , France ? Should not everyone have been awakened to it as an outstanding fact
something	QUPR	would never be done with his ministrations when quite abruptly something broke his revery . It was a fine broody
anyone	QUPR	Deep enough , he decided . There was little chance anyone would enter this shaft during the winter . The
which	SERE	, the old phrase `` angel of the church '' which Biblical scholars have previously interpreted as meaning bishop .
which	SERE	as a member of the prisoners ' Central Committee , which plotted sabotage , planned a few escapes , and
which	SERE	and retrovision . -LRB- The basic mystery of dreams , which embraces all the others and challenges us from even
which	SERE	meter of air over Chicago yesterday . The reading , which has been watched with interest since Russia 's detonation
which	SERE	be bounced off the clouds at 2230 hours , `` which gives us time to get settled in position ''
which	SERE	every year the government is destroying its own taxpayers , which is obviously a silly thing for any government to
which	SERE	It was a bad play , real grade-A turkey , which only a prevalence of angels with grandiose dreams of
which	SERE	of density \*\* f except for the smallest particles , which must have a higher mass density to remain in
which	SERE	with ethyl acetate or two absorptions of \*\* f -LRB- which had been passed through Dowex-2-chloride -RRB- , ~ NS
which	SERE	original composer ; he often uses very odd rhythms , which makes it difficult , and challenging , for the
which	SERE	. Rabies were cured or prevented by `` madstones '' which the pioneer wore or carried . In 1872 there
which	SERE	Rabbits , too , if you care for them , which most of the folk around here have n't the
which	SERE	ideas , and wanted to have his own way - which was the only right way . The entire group
which	SERE	is ~ <X> , the total number of successes , which in this experiment has the value \*\* f. Consider
which	SERE	Next I refer to our program in space exploration , which is often mistakenly supposed to be an integral part
which	SERE	if they showed a comparable increase in this decade , which would carry them to the neighborhood of $ 75-billion
which	SERE	. #EXPLOSION AVOIDED # In the case of Portugal , which a few weeks ago was rumored ready to walk
which	SERE	the common or hydrogen variety , and neutron bombs , which do not exist but are said to be the
which	SERE	focus clearly upon the operation of this one force , which we may call the effect of `` public-limit pricing
which	SERE	say what Thompson expected would come of their relationship , which had begun so soon after his emotions had been
which	SERE	, as animal : the image of a dog , which appears at several places , is first given as
which	SERE	25,000-man Congolese army , the -LRB- Force Publique -RRB- , which had been trained and was still officered by white
which	SERE	of a strong magnetic field to the radical vapor , which shifts the low-frequency spectra to a conveniently high microwave
which	SERE	Forsythe Saga '' and `` Mrs & Miniver '' -LRB- which won her the Academy Award in 1943 -RRB- .
which	SERE	, a staff representative for the United Steel Workers , which the firm 's 25 workers joined before striking ,
seemed	SMP	living exceedingly early in that universal struggle '' , who seemed to have `` all been born on their backs
seemed	SMP	Massachusetts , owners of a large department store . They seemed to be at the White House half the time
appear	SMP	of industry acquiescence . The presumption in the literature would appear to be that the basic wage rate would be
seem	SMP	important than their lives ; and to them it will seem insignificant that it is proposed to defeat such causes
seemed	SMP	' <primary> concern , was introduced only to resolve what seemed to him intolerable in orthodox astronomy , namely ,
seemed	SMP	with dirt on her calves . But just when she seemed to have sunk into some depravity of peasanthood she
seemed	SMP	pessimistic atmosphere of France and all Europe , whose foundations seemed to him more and more shaky . In 1936
seemed	SMP	edge of the bank . From the outside , it seemed no more than a low drumlin , a lump
seems	SMP	bills only '' , or `` bills preferably '' , seems so strongly accepted by the Federal Reserve that it
seems	SMP	frenzy-free . In our age of Science and <Angst> it seems to me more brave to stay on Earth and
seem	SMP	`` Let 's go into the library . You do seem somewhat tattered '' . Cady trailed her with the
seems	SMP	have never been much impressed . There was , it seems to me , enough in the openly declared principles
appeared	SMP	. On the other hand , the women class members appeared to reach a far greater understanding than have women
seeming	SMP	Mary to hold him on her lap without the relationship seeming ungainly ? His Mary would be slender of limb
seems	SMP	nectareous essences ? A tribute to midsummer `` bang-sashes '' seems terribly funny , though it would be hard to
seems	SMP	I have never seen Caper off his feet - he seems to know nothing but ` trot ' and keeps
appeared	SMP	to table the petition . News of the legislative veto appeared in the New Orleans papers , and Henry and
seemed	SMP	the trimmings of a portentous documentary . At least this seemed to be the working hypothesis for `` Chicago and
appears	SMP	Acting Secretary General - at this writing , the choice appears to be certain - offers further proof that in
seem	SMP	I know all about you '' . `` You do seem to '' , said Henrietta , impressed . ``
seem	SMP	service starts with product design and planning : Many products seem to be designed for a production economy , not
seemed	SMP	was nothing that he said or did , but it seemed so <natural> to her that she should be working
seemed	SMP	n't he live in one place the way everyone else seemed to ? It worried him , this inability to
appear	SMP	room of the athletic club . Whenever he deigned to appear at the studio he was `` hung over ''
seems	SMP	as surely directed to him ; to another , it seems that nobody but his father ever used the phrase
had	SPAU	as though it were nectar . I think its thirst had never been assuaged before . Norton and I dined
is	SPAU	unlike any other fruit you have ever tasted . It is roughly shaped like a large pear , and when
may	SPAU	penetration over a long period . The signals to proceed may therefore come when he is momentarily not able to
'll	SPAU	`` I 'll do as you say , but I 'll also play a provisional ball and get a ruling
are	SPAU	elsewhere in Dickens , is here central , and hands are often associated in some way with the false values
was	SPAU	be funny '' . She began to laugh . She was still laughing when I grabbed her and started rolling
has	SPAU	with suspicion and distrust . `` Rarely in American history has there been a political campaign that discussed issues less
is	SPAU	it is open to question . Oliver 's 37-1\/2 feet is partly based on this report and can be accepted
have	SPAU	a belief would not make sense . Broad and Ross have lately contended that this fitness is one of the
would	SPAU	District Attorney M & W & Mills warned that he would vigorously prosecute persons caught committing these crimes or carrying
been	SPAU	sole proprietorship instead of a partnership , I would have been even abler to solve long-range problems for myself and
can	SPAU	he remarks in his preface to <The Walnut Trees,> `` a novel can hardly ever be rewritten '' , and `` when
has	SPAU	actual elements of external reality . In doing so science has unquestionably cleared up widespread misconceptions , removed extraneous and
had	SPAU	Kodyke in the entrance from the outer room . Hague had never accustomed himself to Kodyke . The man was
has	SPAU	dignity and honesty , forthrightness and nobility . SAM RAYBURN has never had to look back at any of his
is	SPAU	list are marked . A location in the computer store is also named for each marked form ; dictionary information
had	SPAU	were beaming under their coatings of dust . Together they had probably done more than any other men to help
has	SPAU	daily toll of time and temper . The Transit Authority has recently placed in operation `` hold '' lights at
might	SPAU	were no other names Madden recognized . Arthur Williams 's might well have been included , he felt . Mrs
was	SPAU	I 've given willful hurt to no man . I was just doing my job , just following orders ,
is	SPAU	, leaned toward the West . Today Sukarno 's government is heavily besieged by avowed Communists , and for all
has	SPAU	of these results to spaces of more than three dimensions has so far been found possible . # 1 .
has	SPAU	, one of the Nation 's most important carriers , has alone lost 47.6 percent of its passengers since 1949
may	SPAU	If an evil which is certain and extensive and immediate may rarely be compensated for by a problematic , speculative
would	SPAU	and while his shot had probably bred indecision , they would soon come hunting . His superiors had emphasized that
to	SPIN	a usable signal , or may be so great as to virtually destroy the service areas of both stations -
to	SPIN	rules . A turnout may have two levers , one to actually move the switch points , the other to
to	SPIN	on the scene unexpectedly , and the antagonists were instructed to deliberately behave in such ways as to upset the
to	SPIN	commerce , where the effect of such acquisition may be to substantially lessen competition between the corporation whose stock is
To	SPIN	the handstand to provide a walkover . #BACK CIRCLE # To further increase back flexibility , work on the back
to	SPIN	about 70,000 miles of forest highways will eventually be needed to fully serve the National Forests . In the forest
to	SPIN	increase can be repealed outright or whether notice would have to first be given that reconsideration of the action would
to	SPIN	devoting 100 hours a month to preaching , but failed to so notify his local board . In a periodic
to	SPIN	'' . I let up on the accelerator , only to gradually reach again the 60 m & p &
to	SPIN	cutting in dead and dying timber stands and the opportunity to promptly salvage losses resulting from fire , windstorm ,
to	SPIN	in his childhood and condemned by unconscious forces within him to tiredly repeat his earliest failure in love , only
to	SPIN	. When the possibility that he had not given reconsideration to so weighty a decision seemed to disconcert his questioners
to	SPIN	party or see a movement come from the loyalist ranks to completely bypass him as a party functionary . With
to	SPIN	words `` matter '' and `` spirit '' both referred to directly known realities in the common experience of all
to	SPIN	is represented on a purely physical plane . Wolfe refuses to ever leave his own house , and spends most
to	SPIN	somewhat less fragmented hebephrenic patient of mine , who used to often seclude herself in her room , often sounded
to	SPIN	need more than a single day to find the words to properly express my thanks to them '' . An
to	SPIN	president Frank SanAntonio said yesterday he may ask the council to formally request Town Solicitor Michael A & Abatuno to
to	SPIN	of religious beliefs and values , the college students seem to faithfully reflect the surrounding culture . Their commitments are
to	SPIN	Pe Potemkin that he made him his aide-de-camp and up to now does not want him to go join Paul
to	SPIN	in thousandths of an inch . Sometimes it is necessary to roughly calculate the square inch area of the opening
to	SPIN	The general basis on which these common costs are assigned to differently measured units of service will be illustrated by
to	SPIN	was to require the boards of election to instruct judges to properly display the American flag . Judges under the
to	SPIN	his point of departure . We did not dare speak to so exalted a being , but Norton aimed his
to	SPIN	the angular deviations of the platform and can be used to automatically hold the platform on true heading . The
you	SPP2	been telling you . I only hope my talking to you has helped you a little , anyway , because
you	SPP2	then , without a second thought . While he talked you would n't trade being a West Tennessee farmer for
you	SPP2	. She said , `` There is nothing that concerns you here . Lie back and go to sleep .
your	SPP2	kill , Wally would have been dead . `` Pack your clothes '' , she hissed . `` Pack -
You	SPP2	the progress of Scotty 's fork or spoon . `` You do n't eat enough , honey . Try to
you	SPP2	left to believe , and the whole world is telling you that <one> was a lie . Even when he
you	SPP2	rest . You stay with the ladies . All of you be ready to ride hell for leather '' .
your	SPP2	This form may be obtained from the local office of your district director . -LCB- RETURNS OF ESTATES OR TRUSTS
