keyword	tag	sentence
you	SPP2	or sculpture '' . `` But , Rabbi Melzi , you do n't object to others creating works of art
you	SPP2	one of the most extraordinary views in Rome . If you look through the keyhole , you will see an
you	SPP2	guess I know enough to turn you inside out , you sockdologizing old mantrap '' ! said Trenchard , otherwise
you	SPP2	all right . Class Three , they said . Do you want to talk to her , doctor '' ?
you	SPP2	! said : `` There are things I must tell you about this man you are marrying which he does
you	SPP2	but away from the crowds and common happenstance . If you 've traveled in Europe a time or two ,
you	SPP2	hang around while I was eating . `` Do n't you think it 's selfish to have dinner <before> you
you	SPP2	the fluid are used up after one year , and you do n't want to risk the rust that two
you	SPP2	bumblebees hibernate in a state of torpor . Occasionally , you may come across one or two bumblebees in the
you	SPP2	, when they were seated , `` when I heard you ringing , I figured it was that guy down
you	SPP2	the palazzo and after two blocks along the Via Giustiniani you will come to the -LCB- Piazza della Rotonda .
your	SPP2	, snag him around the neck with the crook in your cane . Or say a waiter brings you a
you	SPP2	everything out . You do n't need concentration . If you cut down these horrible buildings you 'll have no
you	SPP2	very slowly to avoid binding . Fly cutters can fool you into putting your hand too close to the tool
you	SPP2	my watching him '' , said Charlotte . `` Did you watch him '' ? asked a red-haired girl named
you	SPP2	Len LeSourd is my executive editor today . Many of you are familiar , I 'm sure , with the
you	SPP2	Wilson asked , `` What about this Kent House which you mention ? I do n't understand why a white
in	STPR	, see what he says '' , Chief Moore cut in . `` Does your husband have a car ''
into	STPR	As for rebuilding , well , that might be looked into , but there was no hurry , no hurry
of	STPR	admission to , and to require reports from the operator of , any metal or nonmetallic mine which is in
from	STPR	. Hmm - diddle ! `` Where 'd you come from , Mr & - uh - Mr & Smith
out	STPR	No , sir '' . `` Running in , running out . Ca n't have it . Makes for confusion
of	STPR	But there 's one thing I never seen or heard of , one thing I just do n't think there
out	STPR	light , an ' I 'll put th ' candle out . When yuh come back I 'll put it
off	STPR	clear that as of this moment , the treaty was off . #STERN CHASE 10 # LANGER WOULD HAVE to
of	STPR	Although his tender nights were not the ones I dreamed of , nor was it for yachts , sports cars
on	STPR	. You identify yourself and ask him what 's going on . Instead of answering you , he sticks his
out	STPR	too concerned . He assumed he could blink the splinter out . But it would not come . Argiento never
out	STPR	Alfred , and when the door opened they both came out . Alfred was dressed for his trip to the
off	STPR	push their way into him . The music drove them off , or away , and he was free to
for	STPR	directed against the United States and all that it stands for . Dozens of seemingly small matters go wrong all
on	STPR	window . It winked as steadily as a metronome - on , off - on , off . In less
out	STPR	your head '' ? `` I was hit - knocked out . Now will you get him '' ? ``
except	STPR	principle in human relationships , than at any other time except , perhaps , in the mutual metaphysical orgasms .
off	STPR	over the idea of a good debauchery when I dozed off . I felt better Tuesday evening when I woke
off	STPR	pretty scared himself , wondering what the hell was coming off . But he soon saw which way the ball
between	STPR	two sessions in one evening , with a refreshment period between . The sessions should cover four major areas :
on	STPR	act , the artist is dead but the body lingers on , a shell among other shells . Not altogether
out	STPR	should I ask to be invited in ? In or out , should I kiss her goodnight ? All this
passers-by	STPR	from interruption and the observation and possible amusement of the passers-by . Thus shielded , we played many foolish games
in	STPR	tenacity worthy of Inspector Javert , but before they close in , gird yourselves , I repeat , for a
through	STPR	Army on Leyte , was a Garryowen , through and through . It was no coincidence that Goulding was one
move	SUAV	, who was running the colony , felt constrained to move seven miles south where , with others - as
moved	SUAV	! Dan affirmed , feeling ten feet tall . He moved in close , jerked the handsome , broad-brimmed beaver
suggests	SUAV	had been informed of the possibilities of normal reactions , suggests that their constriction and guardedness is associated with their
moved	SUAV	We have taught him a lesson '' . The crowd moved back and John started dizzily down the hill .
moving	SUAV	Gov & Dalton 's new Commerce and Industry Commission is moving to create a nine-state regional group in a collective
voted	SUAV	of right to walk out at any time when so voted by 51 per cent of the prisoners . #
ask	SUAV	future Legislature sessions . A veteran Jackson County legislator will ask the Georgia House Monday to back federal aid to
voted	SUAV	1954 I imagine that a majority of Southerners would have voted against the Confederacy . Since the Supreme Court 's
vote	SUAV	it was not to grumble about the humidity but to vote unanimously that the United Nations was scarcely less than
decided	SUAV	for the little dogs , and then Mrs & Coolidge decided to leave the radio on for them while she
suggested	SUAV	, was invariably his ungallant and untrue retort whenever I suggested `` starting a family '' . Letch had made
urged	SUAV	real estate brokers and home builders . This pressure has urged re-evaluation of the assumptions underlying their professional ethics ;
required	SUAV	, while not yet having fully accepted the long-range planning required by adulthood -RRB- may develop into a more permanent
resolved	SUAV	American one of 1787-89 rather than the one that was resolved by Civil War . And so I would only
allowing	SUAV	about 200 million dollars . Why should Congress even consider allowing such a sum for that which can give no
determine	SUAV	returns from Questions 1 , 2 , and 3 to determine whether the respondents were large businesses or small businesses
asked	SUAV	enormous debts . In January , 1731 , the company asked the crown to relieve it of the government of
granted	SUAV	do mean , however , that <I> take them for granted , and that everything I shall be saying would
ruled	SUAV	such monstrous proportions . The pair of white cotton shorts ruled his life . Lying awake at night , he
prefer	SUAV	he was less of an `` original '' than we prefer to believe . Need for novelty may be a
Ask	SUAV	lot more than just roads and wells and schools . Ask Mr & Keo '' . Mr & Keo agreed
asked	SUAV	How did you get by the desk '' ? he asked curiously . `` I 'm sure the hotel does
ask	SUAV	'' . Others mentioned that I might have had to ask friends or even strangers for help and that to
decided	SUAV	I know dreamlessly . We met at Maxine 's and decided we were set to stay as long as it
required	SUAV	variables were varied simultaneously , \*\* f operations would be required to do the same job , and as ~
no	SYNE	-RRB- Ptolemaic astronomy would be simpler than Copernican . But no single planetary problem ever required of Ptolemy more than
no	SYNE	, possible that they were men who , having received no tickets for that day , had remained in the
Nor	SYNE	might earn in comparable activities in the United States . Nor would it be possible in many cases for them
no	SYNE	put in gas and electric utility rate cases . Here no attempt is made , first to determine out-of-pocket or
neither	SYNE	he could n't remember her face or her touch ; neither did he care that Aunt Rose provided for him
No	SYNE	large plastic bag , full of wet pink clothes . No wonder she was so pale , wearing all those
nor	SYNE	intricate functions than they had in the earlier writers ; nor is there need to add that among them are
neither	SYNE	I 'll play any more neither '' . `` Me neither '' , others said , and soon the game
no	SYNE	these , conveys a <welter> of feelings which could in no way be conveyed by any number of words ,
nor	SYNE	his disappointment . She understood completely . Not a thought nor a cadence was missed in her summary of appreciation
no	SYNE	bullet holes '' , he said , and there was no question that he was talking about bullets fired by
no	SYNE	n't make the <American> a success , Hearst will have no further use for you '' . The blue-eyed Watson
no	SYNE	, and all contrasts erased , in a realm of no distinction , and the harmonious balance of the <Lo Shu>
no	SYNE	small fortune on a search for him but had made no provision for him in her will if he should
no	SYNE	Indies , holding to its program of economy , made no arrangements to furnish better goods at attractive prices .
no	SYNE	situation . Do n't forget , the U&N & did no more than the United States did \*\* h it
No	SYNE	Eddie Lee moved over to Mike Deegan 's side . No one said a word . The Anniston manager came
no	SYNE	Meeker had snubbed him many a time and he felt no grief over her passing . Even so , Madden
no	SYNE	Arc de Triomphe and the Tour d'Eiffel - I was no yokel , but I was young , and this
no	SYNE	, `` blithe and carefree '' . `` He made no claims to belong to the great and mighty of
no	SYNE	Ross Barnett . Barnett , who came into office with no previous experience in public administration , has surrounded himself
no	SYNE	. We perform elaborate international exhortations and ceremonies with virtually no understanding of social cause and effect . Small wonder
no	SYNE	, were it not that in <Great Expectations> , as in no other of Dickens ' novels , hands serve as
neither	SYNE	ceremonial appearances on and off campus . Since he can neither accept nor reject them all , he must be
no	SYNE	In the end , he gets his man , but no one seems to care ; virtue is its own
that	THAC	waited for Montero . This time he delayed so long that some of the engages shouted frantically , but they
that	THAC	what her Navy had won , the Czarina was fortunate that , for the first time in Russian history ,
that	THAC	metal shutters closed , the dining room was so dark that it seemed still night in there . One of
that	THAC	distinguished `` outside '' faculty . It is particularly interesting that those who framed the report should refer to ``
that	THAC	with the bottom of the glass , he became aware that he was not alone . He looked up with
that	THAC	the foundations of the nation , it is not surprising that many efforts were made to give it concrete expression
that	THAC	of previous hurt , bewilderment and perplexity made him sure that if he did not ask B'dikkat when he ,
that	THAC	and an object is handled , the conclusion seems unavoidable that touch by itself can not focus and take possession
that	THAC	Under this kind of pressure , it is not surprising that Wright would make sweeping statements to the newspapers .
that	THAC	for applying these policies . It was nevertheless almost incredible that four years after Yalta there should be a complete
that	THAC	would make no difference . Now it became increasingly apparent that there were to be no dogs in the picture
that	THAC	these poems is an aberration ; each is so typical that it represents a prominent trend in the poet 's
that	THAC	bully , and so on . It is extremely doubtful that the handful of Albanians who call themselves Communists could
that	THAC	to fight as allies of Britain . It is extraordinary that a people as proud and warlike as Southerners should
that	THAC	a lot of it . And is n't it true that you get a deeper perception about a man and
that	THAC	swear it , sir '' . And it was clear that Adrien was not mistaken , for both Small and
that	THAC	an oedipal fantasy in childhood . It is most probable that Freud and the Oedipus complex never entered his head
that	THAC	a family '' . Letch had made it abundantly clear that he did not care for the company of my
that	THAC	clearly enjoying himself to the hilt and already so tipsy that it seemed unlikely he was bothering to note anything
that	THAC	Jan & 20 . Assuming the weather is halfway decent that day , hundreds of thousands of persons will mass
that	THAC	must act . But one need not always be sure that the action is either wise or conclusive . Apropos
that	THAC	sending , transmitting , and receiving are all so inadequate that networks and decision making are not the bottlenecks .
that	THAC	, for every individual . We must be ever alert that freedom does not wither through the careless amassing of
that	THAC	. ## AS WAS NOTED earlier , it is important that in valid , objective study of this sort of
that	THAC	its masters ; the startling statement in a respectable periodical that `` Catholics , if the present system is still
hear	THATD	season because of a knee injury . `` You often hear people talk about team spirit and that sort of
saw	THATD	tuck it between Cadillacs . -LRB- The last doorman that saw me do that should calm himself . High blood
know	THATD	% of the brain 's total solid weight . They know it is the chief ingredient in gallstones . They
suppose	THATD	strategic forces which continued to threaten us . Let us suppose the Russians decide to build a rail-mobile ~ ICBM
said	THATD	was reported for last month . Treasury Secretary Douglas Dillon said the economy is expected to advance by a whopping
believe	THATD	. Outside the Lincoln was parked . He could hardly believe he was getting in . Pietro was gazing at
thought	THATD	brows , looked like a quizzical Mephistopheles . Some people thought he lacked both ability and character , but most
suspects	THATD	indicated , can be especially expected in cases where it suspects the donor received some material benefit in return ,
believe	THATD	all-married section I would have missed this , and I believe that this single aspect has been of great personal
thought	THATD	Maybe Lou was only unconscious , but right then I thought he must be dead . The man shoved him
think	THATD	with `` Hail to the Chief '' . `` I think they played Hail to the Chief better than the
see	THATD	his yearning , the colonel would not go down to see the men come through the lines . He would
remember	THATD	was death . Alfred knew that , too . I remember him pointing out of the window and saying that
heard	THATD	Ada . Finally she had come down ; Winston had heard her shaking out the skirt of her new pink
think	THATD	no desire to . She said , `` Do you think you 'll miss school '' ? He had noticed
finds	THATD	whether by anyone 's doing or by accident , it finds itself driven to inaction , to non-political action in
think	THATD	can rest assured her position will remain unchanged . I think we have the hardest working , best representative in
found	THATD	turned to a buzz . I circled the block and found he was in the parking lot of a high-class
thought	THATD	The cops did n't suspect a thing , and I thought it was a coincidence . After all , I
said	THATD	National Symphony Orchestra League in Philadelphia last spring . He said he contacted a friend , Henry Hall Wilson ,
meant	THATD	buzz and I knew he was behind me . That meant he 'd parked someplace . I made a big
know	THATD	for a mask . When I show up he will know you are a good wife to have told him
found	THATD	must have put his clothes in the closet . He found a lump rising in his throat because of that
knew	THATD	be crushed like eggs were hard to find . Hudson knew he had to use these men as long as
said	THATD	of civil defense in the city , Mr & Hawksley said he would be willing to bet that not more
that	THVC	in this era liked to imagine -LRB- or pretend -RRB- that he could fight with his fists . And women
that	THVC	the trap and did not suffer at all , but that we mistakenly believe it did , and say as
That	THVC	friend . Then hold it more than bravest-feathered song , That I affirm to thee , with heart of pride
that	THVC	. In general , however , it may be said that when a boy or a girl leaves the high
that	THVC	committee can kill the bill . The West Texan reported that he had finally gotten Chairman Bill Hollowell of the
that	THVC	They looked so formidable , however , so <demanding> , that I found myself staring at them in dismay and
that	THVC	<N'> is nilpotent , and \*\* f. We shall prove that \*\* f. Since ~ <D'> and ~ <N'> commute
that	THVC	Stevenson stated , in the course of his address , that the United States was `` against '' colonialism .
that	THVC	were asked why we thought so , we should say that these things involve great evil and are wrong ,
that	THVC	veterinary medical officer with ~ FDA . This article assumes that the rations you are feeding your beef , dairy
that	THVC	and executioner rolled into one . It will be shown that the <objectives> of the cooperative people in an organization
that	THVC	not leave that to federal judges . Does <Lincoln Mills> suggest that if Congress granted jurisdiction over interstate divorce cases ,
that	THVC	can also be made with a lathe . Scientists say that the world and everything in it are based on
that	THVC	Within a week , however , I began to suspect that something was wrong . For Castro was bringing Cuba
that	THVC	was a murderer , a man of blood , and that he and his associates , with the assistance of
that	THVC	unwarrantable + unnecessary '' check to their friendship and said that she felt that they understood one another perfectly .
that	THVC	recall . He had almost given up when he realized that the dropping of his biwa into the icy jowls
that	THVC	that go into it , and it has been suggested that an additional $ 2 billion increase in total defense
that	THVC	marks and spaces ; <Time> magazine reviewed it and suggested that the Federation Assembly Daily Record should be translated into
that	THVC	subtle vanity that sometimes misleads a great artist into thinking that he or she can somehow better the music by
that	THVC	that he should continue a sinner for ever , nor that the sin which surrounded him should be immortal ,
that	THVC	already operating in every phase of German life , and that the new conspiracy counted on the general anti-Semitism that
that	THVC	demythologized restatement of the kerygma can be achieved ; and that we firmly believe this will presently become evident when
that	THVC	reading the accounts of their testimony you can not believe that the mind can remove , absent itself , unsee
that	THVC	bound the injury . Mike tested the leg and found that he was able to hobble around on it .
again	TIME	generator switch . When he was back on his feet again and about to reinstall the fuses , however ,
earlier	TIME	atmosphere as the Russians , and the fallout from the earlier blasts is still coming down . As it descends
tomorrow	TIME	here tonight too ? We 'll both be blowing town tomorrow so we wo n't be moving in on you
immediately	TIME	, by touch alone , articles which he had handled immediately before , even though they were altogether unfamiliar to
early	TIME	, from linguistic distribution , and from the survivals of early social , political , and religious patterns into later
again	TIME	for a visit to the University of Tokyo . Here again it was vacation time and there were many things
today	TIME	original electrocardiograph primarily indicates irregularities in the heartbeat , but today 's techniques allow exact measurements of the flow of
today	TIME	merely in the limited social-political-economical context we are fond of today . Otherwise , we go on endlessly trying to
now	TIME	control work plus extension of control to 250,000 acres not now protected but which should be managed for white pine
today	TIME	Mag staff , in N & Y & C & today . Handsome bachelor Charley was a favorite date of
again	TIME	so the thermostat opens , and then look for leaks again . Be sure the bugs and dirt are blown
once	TIME	taxis , buses , and motorscooters all went plunging at once down the narrow length of it or swerving perilously
early	TIME	the opera orchestra as well . Steinberg claims that these early years of orchestra participation were of invaluable help to
now	TIME	feet . They were in the center of the lobby now . Still clutching the razor , Roberts came up
now	TIME	of short or at least measurable duration . Foreign policy now takes on a different perspective and must become skilled
early	TIME	bored at all ; he had found his style quite early in his career and he thought it quite wonderful
again	TIME	up , Slate said , and struck the two policemen again . He was then subdued and placed in the
now	TIME	individuals when the season was at its peak , is now rapidly destroyed by the scavenging larvae of certain beetles
today	TIME	the U&S & potato chip industry is that many of today 's successful companies got started during the deep depression
presently	TIME	greater charge than the electron -LRB- so slight it is presently immeasurable -RRB- . This would give the hydrogen atom
tomorrow	TIME	he did say to me , `` If I die tomorrow , still I have had twenty-eight wonderful years ;
now	TIME	it was known that the Luftwaffe in the north was now being directed by the young and energetic General Peltz
today	TIME	were 25 years ago '' . The reason ? People today are aware of the value of orthodontics , and
once	TIME	earth was a little heavy and I had to stop once and clean the plowshares because they were not scouring
Early	TIME	envenomed eyes of Pile of Clouds . And those of Early Spring , haunted and now full of hurt and
that	TOBJ	and that this form will be of such a type that it admits the chaos and does not try to
that	TOBJ	becoming confused or panicked . Sarason <et al> & present evidence that the anxious child will suffer in the test-like situation
that	TOBJ	1602 , George Waymouth , in the same little <Discovery> that Hudson now commanded , had sailed 300 miles up
that	TOBJ	layman . Above all , disabuse yourselves of any thought that I propose to vent moral indignation at your rifling
that	TOBJ	. She had skipped her lunch hour in the fear that he might call while she was out . He
that	TOBJ	in the middle of the Deep . Nick recalled stories that the two best fishing spots in Southern California were
that	TOBJ	For if the small group notion involves the implicit claim that the phenomena of sociological investigations are of atomic or
that	TOBJ	down , he pulled it out and apologetically told Tom that they would n't be able to use it .
that	TOBJ	. Considering only these Fridays , what is the probability that the coach had drivers all 3 times ? Exactly
that	TOBJ	attitude . It was when she was in this position that the name `` prayin ' cow '' was suggested
that	TOBJ	good weather , are getting such high yields per acre that many are being forced to buy new harvesting machines
that	TOBJ	than three miles away , down an old dirt road that the rain had turned into a quagmire . Marty
that	TOBJ	No casts are listed , but Lotte Lehmann sent word that the Negro soprano , Grace Bumbry , will sing
that	TOBJ	wo n't help . I was born angry . Angry that my father was being burnt alive in the mills
that	TOBJ	my double to take it on an opening-day deer hunt that first year . Within half an hour I jumped
that	TOBJ	Civil Service . Much has been made of the fact that major Catholic institutions now guarantee firm tenure . This
that	TOBJ	tell her that his finances were now in such condition that he could go back to Harvard for a third
that	TOBJ	more . It is a weakness of Gabriel 's analysis that he never seems to realize that his so-called fundamental
that	TOBJ	have the healthiest attitude '' . That was the day that Pierre had told Warren about the Abbey of Solesmes
that	TOBJ	thirty-five years of married life could declare with some pride that her husband had `` never seen her entirely naked
that	TOBJ	permission to live in India , coupled with the fact that they were Americans who had been sent to Asia
that	TOBJ	making a good impression . He laughed at a story that he planned to bolt the party if he was
that	TOBJ	many of the larvae apparently receive such a good diet that it is `` optimal '' , and it is
that	TOBJ	troubles . By early summer , he wrote from Laramie that he was suffering from the wound inflicted in the
that	TOBJ	small way , Styka '' . It was an answer that Styka understood . Grabski 's shanty was beyond the
they	TPP3	Figure '' , or `` Pink Figure '' ; and they had -LRB- vaguely -RRB- heads and feet . Exhibited
he	TPP3	passing the time by nursing his favorite grudges . But he decided he would n't mind company in return for
he	TPP3	're getting Friend some runs for a change , and he has been pitching good '' , Murtaugh said .
their	TPP3	for guns , cartridge boxes and hats . They kicked their horses through the deep water with their bare heels
their	TPP3	to find warning notices and threats of infringement suits in their daily mail . `` Purely from the business man
them	TPP3	the rain or other inclement weather , and some of them left momentoes of their stay by carving their names
he	TPP3	He 's more than a reader of outdoor articles ; he 's a real hunter and shooter , eager to
his	TPP3	He felt a puppyish need for company as strong as his earlier necessity for quiet . He stepped out into
she	TPP3	Pa 's hiding places . She 'd found one and she had n't said a word while Big Hans and
his	TPP3	, remarked one gentleman who had been forced to accompany his wife , `` the good Lord can eat where
She	TPP3	, some echo in the way she spoke \*\* h She was watching me intently , a funny little half-smile
He	TPP3	on the grade . Ernie stared at the man . He was big . Real big , with shoulders out
he	TPP3	a child till he was sixteen , a youth till he was five-and-twenty , and a young man till he
he	TPP3	yet nowhere in the whole of the New Testament could he find a description of anybody being baptized by sprinkling
