keyword	tag	sentence
maybe	HDG	a measure of economic security that she needed ; or maybe she liked men old enough to be her father
at	HDG	of cool water . The boy usually was sent out at about that time with the water , and he
Maybe	HDG	bastard I found myself having a fellowfeeling for him . Maybe he felt the same way . I never felt
more	HDG	& Griffith . When he came to the movies - more or less by accident - they were still cheap
Maybe	HDG	enjoy it and such decent , far-flung over-night accommodations . Maybe motel-keeping is n't the nation 's biggest industry ,
more	HDG	, normal personal attrition would make the job reduction provision more or less academic . The situation with regard to
maybe	HDG	us , we could do somethin fine out there , maybe find a place where no one 's ever been
Maybe	HDG	ca n't imagine something like this happening to me . Maybe I should withdraw my advice - no '' ?
of	HDG	, for her : even she had to breathe kind of funny when she was in that position . She
at	HDG	1o ~ cm is like that of a black body at about 6oo ` ~ K. This result suggests a
maybe	HDG	a month , we talk it over again , and maybe if nothing happens meanwhile to say the cops know
Maybe	HDG	was n't too much at fault , Ramey thought . Maybe he was only doing the best he knew how
something	HDG	. There 's better things to do than listen to something like that . I 'll be down at the
maybe	HDG	that blow to be borderline . To kayo him and maybe or maybe not kill . You hit again about
maybe	HDG	on me and for a scared second I thought that maybe Wally was right , and she <was> crazy .
Maybe	HDG	if I can get you into the inner camp . Maybe yes , maybe no , but you can observe
more	HDG	hymen is , in essence , a fragile membrane that more or less completely covers the entrance to the vagina
maybe	HDG	all at once , making the beds , and then maybe painting the kitchen . Then , I remembered that
something	HDG	the stereotype which helps these meanings to become revealed , something like a spread-out deck of cards , on sporadic
nobody	INPR	caressing , anxious movement that , when rain falls and nobody comes , and ruin draws close like a cat
nothing	INPR	watched Miss Langford all morning . He could think of nothing else save his mental image of her nude figure
nothing	INPR	with desire and even experience a flaming delight that had nothing , nothing whatever to do with friendship or liking
nobody	INPR	I turned away from her coldly . `` It was nobody 's fault . She overplayed her hand '' .
nothing	INPR	. He was a big man , and he wanted nothing little , squeezed ; he despised parsimony , and
nobody	INPR	his long fingers . `` Do n't reckon there 's nobody out there , ` cept maybe Dan , who
nothing	INPR	She refused to have a doctor , insisting there was nothing a doctor could do for her . `` Right
nothing	INPR	we did . It just seemed as if there was nothing else <to> do . The finance company took all
none	INPR	unconsciously to build up pressure in a world which demanded none , which was positively antagonistic to it . And
nothing	INPR	When I 'd delivered myself of that gem there was nothing to do but order up another drink . ``
nothing	INPR	were all regulars and masculine -RRB- , the schedule meant nothing . An agreeable ease suffused Vernon and the passengers
Nobody	INPR	and your elders might not like it '' . `` Nobody else can live in your hearth while I am
Nothing	INPR	veldt . There was no ring of animal corpses . Nothing . Nothing but wispy grass whipping in the keen
nothing	INPR	with my money and papers ; Moineau and David held nothing but their fingers \*\* h They felt rough and
nothing	INPR	is working to improve them . His soil was `` nothing special '' , just prairie land , but he
Nothing	INPR	Ithacan wanderer listens on -LRB- <Odyssey> \/ 8,.499-520 -RRB- . Nothing in all this is autobiographical : unlike the poets
nothing	INPR	be at total war with Communism '' ! Since then nothing has happened to save the life of Pope .
nothing	INPR	sneaky little Jenny ! This - trip of his had nothing to do with her consorting with tenants , and
nothing	INPR	walks off , neither pleased nor disturbed , as if nothing had happened . If one dancer slaps another ,
none	INPR	them , but he appreciated the kindliness of her gesture none the less . # \/ 4 , # The
nobody	INPR	was incomparably greater than ours today , for there was nobody before them to show them the way . As
nothing	INPR	, slipping the picture into his breast pocket , saying nothing . Normally Hague wasted no words , but now
nobody	INPR	. Missiles have thrown everything up for grabs , and nobody seems to be sure where we go from here
nothing	INPR	substitute , the proxy sitter . If the latter knows nothing about the absent sitter except his name -LRB- given
Nothing	INPR	There was no ring of animal corpses . Nothing . Nothing but wispy grass whipping in the keen breeze .
must	NEMD	social values , it is clear that the educational profession must work for the values which are characteristic of the
should	NEMD	a vehicle of social identity when their clubs and charities should fill the same need . With capital largely squandered
must	NEMD	old-fashioned mother said to her modern daughter , `` You must have gotten in quite late last night , dear
must	NEMD	law which governs home rule charter petitions states that they must be referred to the chairman of the board of
should	NEMD	motivated , prevent a healthy relationship . Certainly external forces should not be applied arbitrarily out of mere power available
must	NEMD	face of a young boy , the boy Simms Purdew must once have been , a boy with sorrel hair
should	NEMD	stake in the question and in its answer . Who should be consulted among his colleagues in the Department or
should	NEMD	of semi-conductors were ahead of 1959 this year , and should increase again in 1961 . In sum , I
must	NEMD	their advantage . Therefore the second principle of the plan must be that , while providing for all-out hostilities ,
must	NEMD	itself ; if she told anyone of the opium it must be Lucien , her husband . It might be
should	NEMD	the left . Return to the standing position . Care should be taken to see that the hands are placed
must	NEMD	morally related , to what we can and may and must do as long as human history endures . Finally
should	NEMD	jewels and his bargains . Wine bought from a dealer should ideally be allowed to rest for several weeks before
should	NEMD	establishment of new experimental programs are imperative social needs which should command the best efforts of caseworkers in collaboration with
must	NEMD	concerns MEN need unity and they need God . Care must be taken neither to confuse unity with uniformity nor
should	NEMD	That was n't too far from Fifth Street , and should allow him to make Scotty 's Bar by midnight
must	NEMD	of sympathy of the academic professors for art objectives also must be taken into account . One technical question of
must	NEMD	be a corresponding restriction against labor unions : the law must treat everybody equally . Or , in the words
must	NEMD	. The grammatical description of each occurrence in the text must be retrieved from the dictionary to permit such an
should	NEMD	. I do n't get it why this time I should pull such a stupid trick '' . `` Well
must	NEMD	it must have four properties : -LRB- 1 -RRB- there must be a fixed number of trials , -LRB- 2
must	NEMD	fixed number of trials , -LRB- 2 -RRB- each trial must result in a `` success '' or a ``
must	NEMD	business to prepare their young charges for the gymnastics that must come some day if our schools are really responsible
must	NEMD	by his perception of the truth about himself . He must , consequently , exist as a self-perceived substantive ,
must	NEMD	attack must be found and destroyed . Even mobile forces must be found and destroyed . But , how does
distribution	NOMZ	have upgraded their sales manpower and tested new selling , distribution , and promotion techniques to gain a bigger competitive
Education	NOMZ	curriculum planning . The U & S & Office of Education continues to stress local surveys rather than national surveys
activities	NOMZ	the time I devoted to painting or to those other activities a young and healthy man just out of college
prohibition	NOMZ	of other causes - among them women 's rights , prohibition , and justice to the Indians . Incurably optimistic
government	NOMZ	consular materials to reveal the motives which led the British government to permit Garibaldi to cross the Straits of Messina
darkness	NOMZ	man and the fury beyond it and sank into the darkness of her lodge where Walitzee stirred , mumbling ,
infections	NOMZ	, improves feed efficiency , and reduces losses from bacterial infections listed under `` how to feed '' section .
revolution	NOMZ	Round Table was the real starting point for today 's revolution in materials handling '' , says Clarence Thompson ,
investments	NOMZ	as outright speculations are now finding new hope for their investments . Another result is that buyers are tending to
solutions	NOMZ	Final Solution as '' a complement to '' previous `` solutions '' for eliminating the Jews from German living space
Position	NOMZ	while others are closer to the lower oxygen atoms . Position -LRB- 2 -RRB- appears to us to be unlikely
Constitution	NOMZ	demands that the right to secede be put into the Constitution '' . The Constitution of the Southern `` Confederation
Testament	NOMZ	reads : `` The scriptures , both Old and New Testament , are verbally inspired of God and are the
darkness	NOMZ	an hour after nightfall . They had for cover both darkness and a summer storm . During much of the
indictment	NOMZ	She was arrested by Phoenix Police after they received the indictment papers from Portland detectives . A 12-year-old girl ,
refinement	NOMZ	'' to about 8 to 30 hours maximum . A refinement of this technique has been described by Drs &
action	NOMZ	order of Tshombe , again stirred the U&N & to action . On Feb & 21 the council passed another
intonation	NOMZ	the material described in Rowlands ' paper . Tone and intonation often become seriously intermeshed . Neither can be adequately
cities	NOMZ	schools . Desegregation is beginning in two more important Southern cities - Dallas and Atlanta . In each city civic
Nation	NOMZ	stations large enough to afford optimum radio service to the Nation . An example of the overall standards applied is
representations	NOMZ	allows us to think that the patient had no third-dimensional representations when his eyes were closed ? -LRB- 2 -RRB-
involvements	NOMZ	invalidate those of the other two . Because of these involvements in the matter at stake , Boniface lacked the
identity	NOMZ	are doing , rather than on her own sense of identity with given skills , abilities , likes , and
positions	NOMZ	Jewish boys in this town make strenuous exertions to win positions on the school teams . However , in their
governments	NOMZ	independent units of government . There are forty-seven special district governments in Rhode Island -LRB- excluding two regional school districts
a	NULL	are aware of the value of orthodontics , and as a result there are more practitioners in the field .
case	NULL	. `` Well , there 's time , in any case . We 'll wait till you 're stronger and
that	NULL	Yang , while the even numbers were Yin , so that the eight outer numbers of the <Lo Shu> represented these
a	NULL	the summer , many of the larvae apparently receive such a good diet that it is `` optimal '' ,
example	NULL	separate two or more numbers in a row . For example : \*\* f Numbers to be multiplied together may
any	NULL	the stiffness in his arm as an excuse . In any event Rector sent him to the local hospital to
addition	NULL	surface to volume ratio in the reaction tubes . In addition to the method described in the section above ,
the	NULL	, Virginia . Shall we support pupil assignment ? On the other hand , looking at the larger picture ,
less	NULL	opinions '' . He was thrown out , more or less , from Boston , Plymouth , Pocasset , Newport
a	NULL	and might have been poisoned . If there was such a person , I 'm afraid she got away with
lot	NULL	got the goods on you ! It 'll be a lot better if you come clean '' . At first
less	NULL	~ R + ~ D , which work more or less well , depending upon size and actual belief in
comparison	NULL	or boards of education is small , infinitesimally small in comparison with the number of districts . Is the requirement
that	NULL	. I like hay for this and apply it so that only the tops of the plants show right after
a	NULL	no great prejudice against shills ; it just seemed such a dry run . There was no cash around ;
addition	NULL	of the prepared messages by Wisman 's staff . In addition to the authentication and acknowledgment procedures which precede and
as	NULL	feel self-confident enough to take the lead . As soon as that one man is appointed by himself or the
that	NULL	light sources which are sequenced by the rotating mirror so that during one-twentieth of a second only one wavelength ,
hand	NULL	\*\* f has dimension 1 only . On the other hand , the null space of \*\* f and the
a	NULL	From the preceding remarks , it is clear that such a bundle is transformed into itself in an involutorial fashion
example	NULL	federal right . How else can one explain , for example , allowing the survival of the right to amortize
the	NULL	by Soviet aircraft . The Royal Lao Army , on the other hand , was paid and equipped with American
example	NULL	package . Effective employment will reduce force requirements . For example , effective mine barriers from Florida to Cuba and
that	NULL	. The platform is leveled and properly headed , so that the ~ <X> - gyro input axis is parallel
hand	NULL	positions of Buri and Barth and , on the other hand , by the third but really pseudo position -LRB-
since	OSUB	a few 30 - and 50-megaton bombs on hand , since we can not assume that he has exploded his
While	OSUB	side of disk ~ E and join as before . While assembled lid is still on design head , gently
since	OSUB	his comment on the planter dynasties as they have existed since the decades before the Civil War . It may
as	OSUB	and palely shadowed gullies . ## THEY HAD been seen as soon as they left the ranch , picked out
while	OSUB	under his shoe , he started the engine , and while it warmed up he turned to her standing there
such	OSUB	if and only if \*\* f. A function ~ <g> such that \*\* f , i & e & ,
while	OSUB	, your time will come . Enjoy being a bride while you can '' . There was no room for
Since	OSUB	air waves , and is received by the ears . Since the air is a continuum , the network of
since	OSUB	they would coincide at all points , which is impossible since they do not coincide near \*\* f. With each
as	OSUB	. He was able to find meaning in his art as long as it was the answer to air raids
Since	OSUB	<L> , having slope ~ <k> , and \*\* f Since the load ~ <L> , under actual cutting conditions
since	OSUB	Such an operator is obviously the zero operator ; for since it is nilpotent , the minimal polynomial for this
Whereas	OSUB	a considerable difference in the outside books they read . Whereas a high per cent of the regular students can
since	OSUB	of Atlanta , with exception of one brief interlude , since 1937 . His political career goes back to his
since	OSUB	the Allies in August : `` From time to time since the present war began there have been reports that
while	OSUB	scholar-businessman . An inveterate reader of books , he chose while working in Detroit to live in the University community
while	OSUB	for someone to buy , and vice versa . And while all concerned are members of the literal public ,
since	OSUB	being a Southerner , and there is no evidence that since then he has ever considered himself any less so
as	OSUB	payments shall be made to small domestic producers of zinc as long as the market price for prime western zinc
while	OSUB	to retain the nominal classification of `` neutralist '' , while in fact turning the country into an active advocate
since	OSUB	research as head of the school 's famous biology division since 1946 . But he has shown a sixth-sense ability
while	OSUB	1 -RRB- Fence-line bunks - cattle eat from one side while feed is put in from the opposite side of
since	OSUB	-RRB- , nor of the tariff , which was reasonable since it covered everything but the tobacco . Breakfast was
since	OSUB	as John had dreamed , had in the two years since he had been there , continued to be a
so	OSUB	theoretical machinery operate are set out tersely and powerfully , so that all permissible operations within the theory can be
were	PASS	to the employer . -LRB- Incidentally , no Mexican nationals were involved . -RRB- The employer , seeking to continue
is	PASS	active , operational , interested , responsible fashion . He is expected to know about what is going on among
be	PASS	years ago , he had come to the house to be interviewed . The tulips and the big pink peonies
be	PASS	. In any case , our Peace Corps personnel should be offered as technician helpers in development projects of the
'm	PASS	to help his boss . `` My God , I 'm shot '' ! Powell gasped . And he collapsed
be	PASS	be a charge of $ 2.50 for the luncheon to be held in the library and fine arts building .
was	PASS	de la Demographie -LRB- A & Romaniuk , Director -RRB- was formed under ~ AIMO in the Congo , to
be	PASS	invention -LRB- which I shall call <symbol> for reasons to be stated hereafter -RRB- . #THE MIMETIC IMAGINATION IN THE
be	PASS	the spring session of the state Legislature . This might be done to arouse those who have been squeezed out
was	PASS	There was also a boomerang , elaborately carved . Everything was burnished with sweat and grease so that all of
be	PASS	other a dozen times a day . Something had to be done about the furnace , the fuel bills ,
Being	PASS	time in harness he walked off like a gentleman . Being blistered for curbs has delayed his work somewhat .
is	PASS	. The African rock python , a close second , is followed in turn by the reticulate python . There
are	PASS	aching void . Proof ? An average of 50 suicides are reported in America each day ! One out of
was	PASS	Heideman , of rural Elsie , said that a ballot was not even taken until yesterday morning and that the
was	PASS	an oil geologist . The debris of his other careers was piled everywhere ; a pile of wire cages for
was	PASS	and cooked by Viola herself . I realized that Hamlet was faced with an entirely different problem , but his
was	PASS	out of the cab with his money . The victim was beaten when he attempted to stop the bandit .
been	PASS	foreclosing every possible exit from the grove . She had been snared here by a vile sensuality that writhed around
is	PASS	its completed perfection . The supreme object of their lives is now fulfilled , says the wife , her husband
is	PASS	seller or buyer and mediating between them . Professional responsibility is seen to consist largely in serving the wishes of
be	PASS	can render service , interference free , wherever it can be received . On the remainder of the clear channels
were	PASS	materials were not delivered to the handiest spots or materials were not stacked in the right order for erection ,
be	PASS	to ani indifferent condicions . Allso that if monei might be had for 30 or \*\* f a lease +
be	PASS	in the discretion of the Secretary of the Treasury , be required each to be a claims fund to be
divided	PASTP	distance in grades apart : \*\* f ; which , divided by \*\* f gives a mean of 1.07 grades
Decorated	PASTP	glaze -LRB- no glaze on sides or bottom -RRB- . Decorated on unfired glaze with one coat of one-stroke ceramic
Reduced	PASTP	societal response to the impact of the Industrial Revolution . Reduced to its simplest terms , it is an assumption
employed	PASTP	that he was a minister of Jehovah 's Witnesses , employed at night by a sugar producer . He claimed
used	PASTP	Shingles were cured by gentian , an old drug , used in combinations . For erysipelas a mixture of one
sponsored	PASTP	. The earlier of them was an unofficial enterprise , sponsored by <Life> magazine , under the title of <the National purpose>
raised	PASTP	He and Penny would go out on tame elephants , raised from babyhood in the <keddah> . And while he
alarmed	PASTP	the door and listened as his servants ran up , alarmed at the sound of the shots . He heard
Ratified	PASTP	these governmental efforts are desirable as well as necessary . Ratified in the Republican Party victory in 1952 , the
Encouraged	PASTP	Chinaman go to the dentist ? Tooth-hurty '' . -RRB- Encouraged by her giggles he imitated Maggie who was crazy
begun	PASTP	de Venti to the imposing -LCB- Palazzo Farnese , -RCB- begun in 1514 and considered by many to be the
faced	PASTP	the comfortable quarters inside the ship , except that , faced with a possibility of sleeping on solid ground ,
made	PASTP	away . The coffee was n't very hot though , made in a filter pot , but it was good
published	PASTP	stems from a collection of Italian stories , <Il Pecorone> , published in 1558 , although written almost two centuries earlier
calculated	PASTP	relative intensity of 4 -LRB- 14.7 cm & distance -RRB- calculated on the assumptions that the incident light intensity is
supported	PASTP	notion of the Tories as a `` Church Party '' supported by the body of the clergy . Next ,
Come	PASTP	rest her soul , she was a sweet one . Come on now '' . She put a strong hand
filed	PASTP	Once four Tibetan monks , in their saffron robes , filed through the cafeteria line . `` They are n't
written	PASTP	the book , `` A Hero 's Funeral '' , written in the form of an impassioned prose poem .
gleaned	PASTP	. The material is all basically of folk origin , gleaned from every section of Poland . But under the
enclosed	PASTP	closed her eyes , remembering the small French cemetery , enclosed by stone walls . It had always seemed to
fed	PASTP	out of sight in the first stand of trees , fed by a half dozen springs that popped out of
rejected	PASTP	expression of the malaise of the intellectual , who , rejected by and in turn rejecting the larger society ,
stationed	PASTP	2,000 modern Soviet fighters , all better than ours , stationed at 250 bases in Mexico and the Caribbean .
headed	PASTP	no party lines . By rough estimate her Committee , headed by Henry Francis Du Pont , contains three times
has	PEAS	the greatest poem ever written to the guitar because he has never heard of any other poem to that subtle
Having	PEAS	, the reformers among New York City 's Democrats . Having whipped Mr & De Sapio in the primaries and
had	PEAS	boards and restored the six feet of lead line he had excised from the Nernst generator switch . When he
had	PEAS	the bar was an oil painting of a nude Al had accepted from a student at the Corcoran Gallery who
has	PEAS	. Direct proportionality of the rate to the incident intensity has also been assumed in obtaining the value in the
has	PEAS	e -RRB- , and the cycle repeats itself . MERCHANT has found that the same basic relationships which describe the
have	PEAS	Howry and Holmes at the University of Colorado Medical School have applied the same sonar technique to other areas of
had	PEAS	sure that Lucien had filled it with opium . She had quarreled with Lucien , she had resisted his demands
have	PEAS	appeals to morality , to humanity , and to sanity have had such small effect , perhaps our last recourse
has	PEAS	extended , the use of target-hunting noses on the projectiles has been adopted , and the range and breadth of
had	PEAS	& Lewis to Cromwell Hall , and , after she had returned to New York , to ferret her out
have	PEAS	that move material from the yard to the job site have undergone more radical changes than any of the dealer
have	PEAS	Three , <labor troubles> are infrequent . Fiat officials say they have had no strikes for more than six years .
has	PEAS	the past . The contract with Ray Field , who has been converting the agencies electronic data processing program to
has	PEAS	Almighty Dollar , a pope much nearer home . Boston has been controlled by a few capitalists , lawyers and
had	PEAS	done so , could not have found the way , had fortune favored him . And because fortune had favored
had	PEAS	in front of the broken-down ranch house , his hopes had been high . Already some of the pain had
had	PEAS	ugly with the anger in him . She wondered what had taken place in town , between him and his
have	PEAS	say that his attitude was foolish , since he may have been a success had he learned some human relations
have	PEAS	the cliff . I tried to believe that what must have happened was that , restless , disturbed by this
had	PEAS	boating law . Only a few more than 10,000 boats had been registered with the Division of Harbors and Rivers
has	PEAS	power , primarily the voluntary influence of non-authoritative power , has been exerted on actors in the system , particularly
had	PEAS	'' . Although this was the first time that Helva had seen unshelled people , she took this experience calmly
having	PEAS	Island 's durable Democrat -LCB- Theodore Francis Greene -RCB- - having walked , swum and cerebrated himself to the hearty
had	PEAS	at DePaul University . The acoustics of the small hall had been misgauged by the artists , so that for
and	PHC	young citizens should hear only the most carefully selected tales and stories . For this reason , he would banish
and	PHC	Europe ! Trains whistling in the night , the rattle and clatter of cabs \*\* h '' . Finally ,
and	PHC	you find these ? In our present era of Science and <Angst,> the heart has been downgraded , to use
and	PHC	misery . Now all his desires centered on `` rediscovering and singing of the prosaic and yet beautiful world of
and	PHC	could easily be eliminated or from spectra of samples evacuated and sealed off at 375 ` ~ C which contain
and	PHC	harm . If an evil which is certain and extensive and immediate may rarely be compensated for by a problematic
