keyword	tag	sentence
-LRB-	-LRB-	was he who turned the attention of William Lloyd Garrison -LRB- 1805-1879 -RRB- to the subject . Garrison , Massachusetts
-LRB-	-LRB-	, And with never a glance at the sky . -LRB- Oh , ca n't hold the han ' of
-LRB-	-LRB-	Sutherland first sang Lucia at Covent Garden in 1959 . -LRB- The first Metropolitan Opera broadcast on Dec & 9
-LRB-	-LRB-	. As an aid in the prevention of bacterial diarrhea -LRB- scours -RRB- , feed 50 grams per ton of
-LRB-	-LRB-	hand : <The Nation> , Walter Lippmann and other sober commentators -LRB- see Alan Clark on p & 367 -RRB- have
-LRB-	-LRB-	-RRB- , Pennsylvania -LRB- May 31 -RRB- , and Texas -LRB- August 31 -RRB- .  2 .  In
-LRB-	-LRB-	. In a few years we will have ~ SAMOS -LRB- semiautomatic missile observation system -RRB- . But in the
-LRB-	-LRB-	been a problem ever since the introduction of the material -LRB- molding in open molds was more feasible -RRB- .
-LRB-	-LRB-	is the frustration and flagellation of the social sciences . -LRB- Cf & Wetter , 1952 : Pt & \/
-LRB-	-LRB-	. By these measures , Congress , so the Court -LRB- in effect -RRB- now decides , gave not only
-LRB-	-LRB-	\*\* f inches with water at 100-109 ` F & -LRB- 38-43 ` C & -RRB- . When this water
-LRB-	-LRB-	by a New England Baptist clergyman , Samuel Francis Smith -LRB- 1808-1895 -RRB- , while a student in Andover Theological
-LRB-	-LRB-	'' , -LRB- 1 -RRB- `` imbruing his hands '' -LRB- 2 -RRB- in him . As Pip agonizes over
-LRB-	-LRB-	short bones . The mean onset age was 25.3 months -LRB- Table 1 -RRB- , and the average Span of
-LRB-	-LRB-	a highly prejudiced account by one of the survivors , -LRB- 3 -RRB- a note found in a dead man
-LRB-	-LRB-	will vary depending upon the type of dimensional restorability procedure -LRB- if any -RRB- to be used . Three specimens
-LRB-	-LRB-	the historic three-hour , coast-to-coast radio broadcast which I bought -LRB- following Father Coughlin and pre-empting the Eddie Cantor ,
-LRB-	-LRB-	in 2:25 ; Eddie Duke , ~ p , 3 -LRB- by Duke of Lullwater -RRB- , Marilyn C &
-LRB-	-LRB-	, it is necessary to mark distances on a specimen -LRB- or garment -RRB- in both lengthwise and widthwise directions
-LRB-	-LRB-	many others . Nakamura -LRB- ' 58 -RRB- , Verloop -LRB- ' 48 -RRB- , Marchand , Gilroy and Watson
-LRB-	-LRB-	a short cut into Catskill . After spending two nights -LRB- Wednesday and Thursday -RRB- in Catskill , the deputies
-LRB-	-LRB-	Revulsion '' -LRB- 1866 -RRB- and `` Neutral Tones '' -LRB- 1867 -RRB- . There is not much to be
-LRB-	-LRB-	<Discovery> down the east coast of the newly discovered sea -LRB- now called Hudson Bay -RRB- , confident he was
-LRB-	-LRB-	dividend carryover to a personal holding company -LRB- section 381 -LRB- c -RRB- -LRB- 14 -RRB- -RRB- , but not
-LRB-	-LRB-	other hand , by the third but really pseudo position -LRB- analogous to a round square -RRB- of Bultmann .
-RRB-	-RRB-	he will advance by increased allowances or new fund-raising efforts -RRB- . No matter how high the hopes and dreams
-RRB-	-RRB-	are significant : -LRB- 1 -RRB- situs , -LRB- 2 -RRB- fair and equitable assessment of value . These problems
-RRB-	-RRB-	just move sex '' . @ Leila -LRB- Malia Phillips -RRB- , 25 , is a Greenwich Village painter of
-RRB-	-RRB-	the yellow pages of the telephone book were amazingly thin -RRB- . They were `` personalities '' . Herb ,
-RRB-	-RRB-	Investigation reports might disclose . Section 6 -LRB- ~ j -RRB- of the Act , as we have held ,
-RRB-	-RRB-	by voice vote -RRB- and the House -LRB- by 224-170 -RRB- passed and sent to the White House the compromise
-RRB-	-RRB-	blood group antibodies . These include low-temperature ethanol -LRB- Cohn -RRB- fractionation , electrophoresis , ultracentrifugation and column chromatography on
-RRB-	-RRB-	Children 's Handling Class -LRB- as they were called then -RRB- at Westminster . No sooner had Betsey come out
-RRB-	-RRB-	quite superficial . Yet -LRB- Britain in the nineteenth century -RRB- became the <vade mecum> of beginning students of history ,
-RRB-	-RRB-	volley . -LCB- The Percussive Twenties -RCB- -LRB- ~ SP-44006 -RRB- stirs pleasant memories with well-known songs of that day
-RCB-	-RRB-	professor has designed a piece of apparatus that -LCB- forces -RCB- the bodybuilder to use a w-i-d-e grip \*\* h
-RRB-	-RRB-	-LRB- the only one with whom this technique was tried -RRB- . This subject , who has been undergoing psychoanalytic
-RRB-	-RRB-	-LRB- L'Union Marocaine des Commercants , Industrialistes et Artisans -RRB- -RRB- was opposed by candidates of the new U&N&F&P &
-RRB-	-RRB-	areas to the north and south sides of the house -RRB- . They 're easier to shade there . An
-RRB-	-RRB-	under way . Those who enter the -LRB- front door -RRB- of the church intelligently and with Christian dedication will
-RRB-	-RRB-	the P&D&I & -LRB- -LRB- Parti Democratique de l'Independance -RRB- -RRB- , the most important minor party at the time
-RRB-	-RRB-	-LRB- 1 -RRB- `` imbruing his hands '' -LRB- 2 -RRB- in him . As Pip agonizes over the theft
-RRB-	-RRB-	The novels and stories like Pohl 's <Drunkard's Walk> -LRB- 1960 -RRB- , with the focus on adventure and with the
-RRB-	-RRB-	breaching the conservative barriers around the Rules Committee : 1 -RRB- to pack it with additional liberals and break the
-RRB-	-RRB-	the inhuman hour of starting -LRB- seven in the morning -RRB- , nor of the tariff , which was reasonable
-RRB-	-RRB-	terms -RRB- , ratios 3.9 versus 4.7 ; -LRB- 4 -RRB- verbs -LRB- 9 , 22 terms -RRB- , ratios
-RRB-	-RRB-	the students more and more as they move through college -RRB- . Even in such technical curricula as engineering ,
-RRB-	-RRB-	accounting -LRB- section 381 -LRB- c -RRB- -LRB- 4 -RRB- -RRB- or depreciation -LRB- section 381 -LRB- c -RRB- -LRB-
-RRB-	-RRB-	antibodies showed activity in both regions -LRB- Fig & 1 -RRB- . In all cases the activity against \*\* f
-RRB-	-RRB-	us of the strange incident in -LRB- Something About Myself -RRB- . One day when he attended a war memorial
completely	AMP	the following chapter , no rate relationships can be made completely nondiscriminatory as long as all or some of the
highly	AMP	`` a must '' . He moved in a `` highly intellectual '' group in Greenwich Village in the late
very	AMP	: '' To escape from a prison camp required a very special state of mind ; not only loathing of
very	AMP	lower key . But this argument can not be pushed very far because the Communist system makes up for any
highly	AMP	town -LRB- township -RRB- where the project is located think highly of it because it simplifies their snow clearing problem
very	AMP	the importance of the Regulus \/ 2 , , a very promising aerodynamic ship-to-surface missile designed to be launched by
utterly	AMP	a child I used to play '' . He is utterly disappointed in himself and in the desultory life he
very	AMP	of freedom around the world , depend , in a very real sense , on their ability to build growing
very	AMP	more , the legends have become so sacrosanct that the very habit of self-examination or self-criticism smells of low treason
very	AMP	lie around on the rug during the meal , a very pretty sight as Rob Roy , Prudence , and
very	AMP	pedestrian modes of activity , Merce Cunningham has selected a very different method for achieving his aim . He rejects
very	AMP	human condition . And they have done this on a very large scale , with a veritable flood of novels
very	AMP	greater margin of safety in any activity . It is very important for parents to understand that early training is
very	AMP	. It could all be straightened out later . Not very much later , but when things had settled down
very	AMP	writing a new poetry for reading with jazz that is very closely related to both the musical forms of jazz
very	AMP	is going to be to the pocketbook and may be very convincing to those who do not see its relation
very	AMP	localities . Alphonse R & Hoge 's measurements of several very young specimens from Brazil suggest that at birth the
very	AMP	paint as and when they are ready with only a very little demonstration . SEEN in decorating circles of late
entirely	AMP	while a `` straight steer herd '' was one composed entirely of steers , and when the cowman spoke of
very	AMP	. It could be seen that both artists used a very thick final coat of plaster , one half inch
very	AMP	mopping his brow . The expedient thing - yes , very true , one must make do as one could
perfectly	AMP	, the emblematic , the expressionistic . In a certain perfectly definite way , the method and the theme of
very	AMP	~ cm emission of the moon during a lunation is very much less than the variation in the 8.6 -
very	AMP	Saturn have been observed as radio sources , and not very much information is available . Mars has been observed
greatly	AMP	S -RCB- o far in history man has been too greatly over-occupied with projecting things into his environment rather than
And	ANDC	, but he was more wiry than truly strong . And his relatively small hands and feet gave him an
and	ANDC	6 out-of-state directed to electronics , plastics , pharmaceutical , and business machine manufacturers , and to publishers . These
and	ANDC	as what she was . To be Katharine Ross , and work in a nicer shop somewhere , at a
and	ANDC	upon and manifested in a negative policy of Containment - and the bitterest irony - enforced and enforceable only by
and	ANDC	Each Journal contained articles of professional and clinical interest , and departments devoted to military medical news , reviews of
and	ANDC	he said , `` Tell me about yourself '' , and Linda Kay told him , because she thought herself
and	ANDC	privately-owned vehicles was a personal hardship for such employees , and the matter of providing state transportation was felt perfectly
and	ANDC	a marriage that began with a promise of happiness , and ended in long years of suffering and hatred .
and	ANDC	Before long the atmosphere reverted to its old normalcy , and insects hummed and birds occasionally called . Matsuo puzzled
and	ANDC	into our authors - Nathaniel Hawthorne , for example , and Herman Melville - protests against modernism , material progress
and	ANDC	to be employed in the `` transition to communism '' and , last but not least , on foreign policy
And	ANDC	! -RRB- Yes , I went to the city , And there I did bitterly cry , Men out of
and	ANDC	of Senators . Georgia 's Dick Russell objected politely , and the battle was joined . Privately , the liberals
and	ANDC	be different . Japan did something to a man - and it was n't just Japan , either , because
and	ANDC	, by E & Y & Harburg and Duke , and by Harry Myers . Entrance into such stellar song
and	ANDC	shipper . Some of them are very delicious indeed , and there are many good ones exported - unfortunately ,
and	ANDC	has been living in a gilded palace , perhaps , and wants a real big heap of contrast -RRB- .
and	ANDC	stirs pleasant memories with well-known songs of that day , and Johnny Keating 's Kombo gives forth with tingling jazz
And	ANDC	iron , cloth , rubber , and so on . And he could recognize , by touch alone , articles
and	ANDC	things rarely ever work out in such cut-and-dried fashion , and that car loadings , while perhaps interesting enough ,
and	ANDC	The main set of bars are the `` tappets '' and one tappet is connected to each lever . If
and	ANDC	steadier , the waters cooler , the fish hungrier , and rivers more pleasant - less turbulence and mud ,
and	ANDC	the cycle so that the machine literally runs backward , and the heat is extracted from outdoor air and turned
and	ANDC	of the same individual object or type of object ; and this he could do only by going over its
and	ANDC	that in this hour both of `` national peril '' and of `` national opportunity '' we can take counsel
is	BEMA	unhappy incident '' can now be closed . But Albania is merely a symptom of a real malaise between China
Are	BEMA	Friday in order to have an uninterrupted work week ? Are you carefully policing wash-up time and rest periods to
be	BEMA	judging , the A&K&C & requires that a licensed Handler be present to judge the Class . If the superintendents
are	BEMA	of God '' and `` the foolishness of men '' are simply two ways of talking about the same thing
is	BEMA	& . Now , if any part of the Bible is assuredly the very Word of God speaking through His
is	BEMA	AN ARMY TO WIN # `` Defeat Into Victory '' is a dramatic and lively military narrative . But it
is	BEMA	of thickness ~ <t> from the substrate . \*\* f is the shear force along the shear plane ; \*\*
is	BEMA	tone languages generally , those who are convinced that tone is merely an unnecessary marginal feature in those languages where
is	BEMA	to Outdoor Education . Considering that the current school-age potential is 23 million youths , the project and its message
been	BEMA	carried away . The aimless milling about of what had been a well-trained , well-organized crew struck Alexander with horror
was	BEMA	driveway standing in the cold fog , mad as she was at his going away when he really did n't
is	BEMA	lead to audience control . And the tone she commands is always beautiful in sound . Since she also has
be	BEMA	`` Never could figure out why you ever wanted to be a cop , Jed . You 're not only
was	BEMA	. With Ramey it was a dusty work shoe that was half-off the Indian 's foot that he would always
was	BEMA	a stretch to make even that measurement . The man was just this side of being a freak . We
are	BEMA	EWC -RRB- . It was observed that ~ EWC macromolecules are the same diameter -LRB- 15 ~ A -RRB- but
been	BEMA	with his father , old Titus , who must have been in his nineties when Henrietta ran away . Next
was	BEMA	with a gun in his pocket . And that gun was empty . Even before his mind had rounded out
been	BEMA	account . Neither of them , I understood , had been present at the filming session earlier . `` What
be	BEMA	Birkhead declined on the grounds that one of them must be in the United States when -LRB- Elmer Gantry -RRB-
was	BEMA	intensely and showed it . Gunny symbolized so much that was unpleasant - Tolley , the indifference with which the
is	BEMA	Mr & Smith , like the present Secretary General , is a lawyer ; and lawyers - with the great
are	BEMA	, and not merely whether disciplined agents of the Cominform are in control of governments from which they were formerly
is	BEMA	of the procedures and formalities of racing . The necessity is not clear to me , and , in any
be	BEMA	, even the characteristics of bronchial arterial blood flow might be different in the dog than in the horse .
be	BYPA	the unfertilized eggs of workers , although a few may be produced by the queen . The young queens and
is	BYPA	. The present status of food preservation by ionizing radiation is discussed by food classes in the following paragraphs .
was	BYPA	. My friends and I come from a ship which was destroyed by fire . We are thirsty and hungry
were	BYPA	City and rode thirty-five miles up the Vermejo where they were joined by Juan Jose Martinez . By 3:00 A&M
being	BYPA	other government agencies . The new editions of topographic maps being made by the federal government are excellent for orienting
been	BYPA	craters , and recent craters containing impact glass have all been produced by metallic meteorites with the exception of Aouelloul
is	BYPA	operations in any form of war . The first capability is represented by a combination of manned bombers , carrier-based
was	BYPA	of flower . Every path from back door to barn was covered by a grape-arbor , and every yard had
is	BYPA	and importance of the whole abstract movement . And it is thought by many who think about such things that
being	BYPA	the earth '' . Patchen believes that the world is being destroyed by power-hungry and money-hungry people . Running counter
was	BYPA	of 77-294 ` K. For the low-temperature measurements the sample was cooled by a cold nitrogen gas flow method similar
were	BYPA	. The contents of the manifold for liquid phase experiments were then mixed by shaking , redistributed to the reaction
is	BYPA	assembly and disassembly of the apparatus . This negative pressure is not explained by the velocity head \*\* f since
being	BYPA	undeniable fact that some of the finest American fiction is being written by Jews , but it is not <Jewish>
is	BYPA	passages and sliding panels and , unbeknownst to anyone , is still occupied by an eccentric maniac . It was
was	BYPA	a court that Miriam would be awarded Taliesin ; nor was she moved by a letter from Wright pointing out
were	BYPA	blasphemy and tried for their lives . Four ecclesiastical questions were presented by the General Court to Gorton : ''
be	BYPA	is the result of a psychological compulsion . It may be fostered by frustration , depression , insecurity - or
was	BYPA	whether to continue or end it . Though his election was interpreted by many Southerners as the forerunner of a
are	BYPA	to where misunderstanding has almost zero possibility . The commands are specified by the military regulations ; are few in
was	BYPA	or the <Glasgow Herald> . Later , rising ninety , he was beset by publishers for the story of his life
been	BYPA	will fully justify the investment . Long term loans have been reduced by $ 395,000 to $ 2,461,000 . Inventories
are	BYPA	page -RRB- . Measurements for rectangular pattern piece ~ A are obtained by measuring inside circumference and depth of butter
were	BYPA	. Most of their original objections about `` shells '' were overridden by the relief that these hideous -LRB- to
were	BYPA	binomial '' when the context is clear . Binomial distributions were treated by James Bernoulli about 1700 , and for
because	CAUS	they did also fall under the power of death , because they did eat in disobedience ; and disobedience to
because	CAUS	pure reagents . We are reporting these investigations here briefly because of their relevancy to problems of the study of
Because	CAUS	either dystopias or narratives of adventure with dystopian elements . Because of the means of publication - science-fiction magazines and
because	CAUS	voters '' , who `` believe that voting is useless because politicians or those who influence politicians are corrupt ,
because	CAUS	the table crazy to get my hands on her partly because I wanted to wring her neck because she was
because	CAUS	labor dispute , and no workers have left their jobs because of the dispute , we may continue to make
because	CAUS	She had always been able to ignore the moral question because there had been no choice . Only at this
because	CAUS	to go to church ? he wondered \*\* h Probably because it was a place where she might get a
because	CAUS	perfect peace , whose mind is stayed on thee : because he trusteth in thee '' -RRB- . Are you
because	CAUS	It is perhaps too late now to talk of mandate because it is inconsistent with what is termed political realism
because	CAUS	tell us , sir , that we are free , because we have in one hand a ballot , and
Because	CAUS	the additional cost must be attributed to the fence . Because of their location , on the edge of the
because	CAUS	- that was out ; two others he ruled out because all their windows were lighted . That left three
because	CAUS	death by a madman - he could not fight back because madmen are sacred to Islam - he throws up
because	CAUS	& 14 , 15 -RRB- . In this instance , because of incomplete septation , the secondary lobule does not
because	CAUS	existing chaos . The Congo should have been mandated , because it was not ready for independence . The idea
because	CAUS	ramming into that kid out there . He did it because he knows for each guy he puts out of
because	CAUS	death , and thus death has passed unto all men because all have sinned . Romans 5:12 . You also
because	CAUS	drifted away from the gang . Mousie said it was because he was too proud to stand pity . Others
because	CAUS	to re-establish in him a new morale that is firmer because it is based on sounder values '' . A
because	CAUS	vain and incurably sentimental among us will lose sleep simply because foreign peoples are not as impressed by our strength
because	CAUS	not because she had lost a beloved husband , but because she had been married to a man who thought
Because	CAUS	`` Why ca n't I , Doctor '' ? `` Because , Fred , it could do him no good
because	CAUS	she could n't understand their subsequent actions . Was it because she had shown panic ? Who could blame her
because	CAUS	the same project . There should be no draft exemption because of Peace Corps service . In most cases service
though	CONC	radio on for them while she was gone , even though her husband disapproved of the waste of electricity .
though	CONC	that done it \*\* h There was something troubling him though : as yet <they hadn't> \*\* h Five days \*\*
although	CONC	Throughout these exciting years I have been fortunate for , although I have never offered great financial inducements , talent
Though	CONC	4 . Socialization 5 . Social control 6 . Institutionalization Though undoubtedly all six processes are operative within the whole
though	CONC	goes back to the Declaration of Independence , too , though I may add , with considerably more historical perception
although	CONC	with an ash can -LRB- and foraging dog -RRB- , although Sloan was a member of the famous `` Eight
Although	CONC	luck at all he could easily find a flowerpot . Although it was only three o'clock , he stopped in
although	CONC	in Pulaski County is pending because of court order , although date of admission is not yet determined . Negro
though	CONC	Neesen , a member of the ~ IRSAC staff , though the inquiry was carried out under the auspices of
though	CONC	outsider . When they learn you 're in the hills though , they 'll rally , do n't worry about
although	CONC	their achievements and their impact . Political theoretical understanding , although almost at a standstill during this century , did
though	CONC	because it was selected with little conscious reflection . Time-servers though the periphrastic expressions are , they may nevertheless be
though	CONC	was , with his hands across his chest , as though surfeited with honey . Violence always made him tired
though	CONC	'' ? The terms are generally taken for granted as though they referred to direct and axiomatic elements in the
although	CONC	types of message listed in Table 1 are permitted , although decorum and cocktail tradition require holding the commands to
Though	CONC	over it 'd crash onto its head and shoulders . Though the slightest yank was frequently capable of producin '
Although	CONC	a spring-back action which is much desired in cushioning . Although the first polyether foams on the market had to
although	CONC	Statistically this has represented a loss to the nation , although one must admit that in an individual case the
though	CONC	not be our primary objective in the foreseeable future - though perhaps the `` political general staff '' of Western
Although	CONC	HOW WILL THE PEACE CORPS BE RECEIVED ABROAD ? # Although the need for outside trained manpower exists in every
Although	CONC	herself from bursting out with her dramatic tidings . `` Although it is not the best of which he is
although	CONC	assets for stock . It appears , then , that although the matter is not dealt with in section 381
though	CONC	Much of this necessary increase in research and development , though properly chargeable to current expenses , is not reflected
although	CONC	to the door . I was at once disappointed , although just what I had expected him to look like
Although	CONC	bed , and a nursery with a life-like doll . Although the training is only for one month , it
if	COND	which the detective bureau despatched rifle squads to prevent trouble if O'Banion should send his gunmen out to deal with
if	COND	up to Paul Richards today and asked the Oriole manager if he thought his ball club would be improved this
if	COND	so high that the top falls gently over , as if to show that it really is hair and not
if	COND	Jesus an authentic Jew . I can not accomplish this if you will not help me '' . The rabbi
if	COND	plane curvature leading to defocusing in the peripheral image region if a flat viewing screen -LRB- or interstage coupler -RRB-
If	COND	WE ARE BORN OF GOD WE PRACTICE RIGHTEOUSNESS .  If you know that he -LRB- God -RRB- is just
if	COND	him , yet he knew he would not care even if it did . He shook his head . ``
If	COND	the theory could be saved in one way only . If it could be shown that judgments of good and
unless	COND	later we must get rid of Castro , `` for unless we do we 're liable to face similar situations
If	COND	to interview her . Make them show their hands . If they are Beach cops on a stake-out , they
If	COND	collective-bargaining system is the removal of wages from competition . If a union can not perform this function , then
If	COND	solicitor general , and other officials and their clerks . If he borrowed money from Shakespeare or with his help
if	COND	for the Kansas City Medical Depot when he decided that if he was going to make the Army his career
If	COND	on the kind and scale of your farming venture . If you are not well acquainted with the area in
if	COND	\*\* h. The world might ring with the struggle , if we devoted ourselves exclusively to belaboring each other ''
if	COND	. A dozen cows mooed sadly and regarded us as if we were insane , as perhaps we were at
if	COND	and even for the whole duration of married life , if there are serious reasons , such as those often
if	COND	If the house is not wired adequately for electricity or if plumbing or a central heating system must be installed
if	COND	. Fall River police did go to Westport to see if they could get any information against Morse and possibly
if	COND	same time dreaming of the startling effect he would make if he should proclaim himself suddenly as the composer .
If	COND	in Germany and wherever else they could find it . If anti-Semitism was on trial in Jerusalem , why was
